{
  "$schema": "https://schemas.skeletonkey.dev/locators/0.1/schema.json",
  "specVersion": "0.1.0",
  "id": "phase-023-notepad",
  "name": "Phase 23 Notepad",
  "description": "Cross-version UI Automation targets for the Windows Notepad editor.",
  "locators": {
    "editor": {
      "description": "The editable Notepad document.",
      "cardinality": "one",
      "strategies": [
        {
          "kind": "role",
          "role": "document"
        },
        {
          "kind": "role",
          "role": "textbox"
        }
      ]
    }
  }
}
